URL,アーカイブ日,title,meta_description,H1,H2,H3,body_text,備考,発リンク1_URL,発リンク1_テキスト,発リンク2_URL,発リンク2_テキスト,発リンク3_URL,発リンク3_テキスト,発リンク4_URL,発リンク4_テキスト,発リンク5_URL,発リンク5_テキスト,発リンク6_URL,発リンク6_テキスト,発リンク7_URL,発リンク7_テキスト,発リンク8_URL,発リンク8_テキスト,発リンク9_URL,発リンク9_テキスト,発リンク10_URL,発リンク10_テキスト,発リンク11_URL,発リンク11_テキスト,発リンク12_URL,発リンク12_テキスト,発リンク13_URL,発リンク13_テキスト,発リンク14_URL,発リンク14_テキスト,発リンク15_URL,発リンク15_テキスト,発リンク16_URL,発リンク16_テキスト
http://dickinson-film.jp:80/emily/,2017-07-04,エミリ･ディキンスン | 映画『静かなる情熱』公式サイト,アメリカの詩人生前に発表した詩の数：１０篇 死後発見された詩の数：約１８００篇生涯独身を貫き、後半生を、白いドレスを着て屋敷から出ることがなくなる。,,Emily Dickinson | エミリ・ディキンスン ファンのアーティスト | 語録 *詩からの抜粋,,menu ニュース イントロダクション エミリ･ディキンスン ストーリー 海外評 キャスト スタッフ 予告編 劇場情報 Twitter Facebook Emily Dickinson ホーム エミリ･ディキンスン アメリカの詩人 生前に発表した詩の数：１０篇 死後発見された詩の数：約１８００篇 生涯独身を貫き、後半生を、白いドレスを着て屋敷から出ることがなくなる。 ＊家族：父エドワード、母エミリ・ノークロス、兄オースティン、妹ラヴィニア 1830年12月10日 マサチューセッツ州アマストに生まれる。 1840年～47年 断続的にアマスト･アカデミーで学ぶ。 1847年9月30日 アメリカで最初の女子大マウント・ホリヨーク女子専門学校に入学。 1848年8月 同校を退学し、家に帰る。 1852年2月20日 スプリングフィールド･リパブリカン紙に、エミリの詩が掲載される。 1858年 詩作を保存し始める。 1862年 エミリの生涯で一番多作な年。 1864年～65年 眼を傷め、失明を恐れる。 1874年6月16日 父、ボストンで死去。 1882年11月14日 母死去。 1884年6月14日 エミリ発作で倒れる。 1885年11月 ブライト病（腎臓炎）が悪化、病床につく。 1886年5月15日 エミリ、ブライト病がもとで死去（55歳）。 妹がエミリのたんすの抽斗から46束の詩稿を見つける。 エミリ・ディキンスン ファンのアーティスト サイモン＆ガーファンクル 「夢の中の世界」「エミリー、エミリー」 ウディ・アレン 短編集「羽根むしられて」 ターシャ・テューダー 「まぶしい庭へ」 チャールズ・シュルツ 「スヌーピー」 語録 *詩からの抜粋 私は誰でもない！ あなたは誰？ 脳は、空よりも広い。 希望は羽を持った生き物 魂の中にとまり、 言葉のない歌を奏でる 決して休むことがない あなたの小さな胸に 小川をお持ちですか？ エデンの園とは、私たちが日常住んでいるあの古い家のこと 自然は最も優しい母親である どんな子供にもイライラしたりしない 心にはたくさんのドアがあります 私はただノックすることができるだけ 愛される者は死ぬことはない 愛は不滅だから 平和の宗教を持つ人間にとって、その最高の価値は愛である 戦争の宗教を持つ人間にとって、その最高の価値は闘争である 映画『静かなる情熱』公式サイト PAGE TOP,,https://www.facebook.com/dickinsonfilm/,ニュース,https://twitter.com/dickinson_film,Twitter,https://www.facebook.com/dickinsonfilm/,Facebook
http://dickinson-film.jp:80/introduction/,2017-07-04,イントロダクション | 映画『静かなる情熱』公式サイト,北米の小さな町アマストで、白いドレスを着て 美しい自然につつまれた屋敷から出ることなく 無名のうちに亡くなったエミリ・ディキンスン。,,Introduction,,menu ニュース イントロダクション エミリ･ディキンスン ストーリー 海外評 キャスト スタッフ 予告編 劇場情報 Twitter Facebook Introduction ホーム イントロダクション 北米の小さな町アマストで、白いドレスを着て 美しい自然につつまれた屋敷から出ることなく 無名のうちに亡くなったエミリ・ディキンスン。 死後、部屋から1800篇近くの詩が発見されて 今や、世界の多くの芸術家に影響を与えている。 1886年、北米マサチューセッツ州の小さな町アマストで、ラヴィニア・ディキンスンは整理ダンスの引出から、清書されて46束にまとめられた1800篇近くに及ぶ詩稿を発見した。それらは亡くなった姉エミリのものだった――。 「静かなる情熱 エミリ・ディキンスン」は、アメリカを代表する女性詩人エミリ・ディキンスン（1830－1886）のベールに包まれた半生を描いた作品である。エミリは清教徒主義の影響を受けるアメリカ東部の上流階級で生まれ育ったが、やがて後に伝説となる、白いドレス姿で屋敷から出ることなく、孤独な生活を送るようになり、数多くの詩を書き残した。 彼女の詩は、自然や信仰、愛や死をテーマに、繊細な感性と深い思索のなかで記されたものだ。その独特のスタイルからは詩作への強い信念が感じられる。エミリは生前に評価されることは、ほとんどなかったが、いまや文芸にとどまらず、多くの芸術家に影響を与えている。武満徹は詩から着想をえて「そして、それが風であることを知った」を作曲し、サイモン＆ガーファンクルは彼女にまつわる歌「エミリー・エミリー」「夢の中の世界」をアルバムに収め、ターシャ・テューダーは「まぶしい庭へ」で挿絵を手がけたほか、チャールズ・シュルツの漫画「スヌーピー」の題材にもされた。またウディ・アレンはエミリのファンで、著書の短編集のタイトル「羽根むしられて」は、エミリの詩の一節、“希望は心の中に留まる羽根のあるもの”（新倉俊一訳）と照応していると語っている。 本作は、エミリ・ディキンスンという偉大な詩人に捧げられたオマージュである。撮影はアマストにあるエミリが実際に暮らした屋敷とスタジオで行われ、約20篇の彼女の詩を織り込み、彼女のかたくななまでに思いを秘めた少女時代から、詩作を心の拠りどころにした晩年から死までを、敬愛の思いをこめて描いている。人生と死、そして永遠を真正面から見つめつづる孤独な魂の姿は、リアルなまでに見る者の琴線にふれるだろう。 監督は、「遠い声、静かな暮し」（1988）のイギリスの名匠テレンス・デイヴィス。寡作ではあるが、その誠実な作りにファンは多い。「ディキンスンは死後に評価されましたが、それは不当です。彼女は真に偉大な芸術家であり、永遠に賞賛されるべき人です」と語っている。主人公エミリを演じるのは、ベテラン女優のシンシア・ニクソン。7年にわたって放送された人気テレビドラマ「セックス・アンド・ザ・シティ」のミランダ役でエミー賞助演女優賞を受賞している。シンシアはエミリ・ディキンスンの熱心な愛読者でもあり、難しい役柄に果敢に挑み、大きな評価を得た。 映画『静かなる情熱』公式サイト PAGE TOP,,https://www.facebook.com/dickinsonfilm/,ニュース,https://twitter.com/dickinson_film,Twitter,https://www.facebook.com/dickinsonfilm/,Facebook
http://dickinson-film.jp:80/review/,2017-07-04,海外評 | 映画『静かなる情熱』公式サイト,☆☆☆☆☆“デイヴィスがディキンスンを描いたことで最高の作品が生まれた”シンシア・ニクソンが、ドラマ「セックス・アンド・ザ・シティ」のミランダ・ホッブス役とはまったくかけ離れている本作品の主役を情熱的に演じている素晴らしい作...,,Review,,menu ニュース イントロダクション エミリ･ディキンスン ストーリー 海外評 キャスト スタッフ 予告編 劇場情報 Twitter Facebook Review ホーム 海外評 ☆☆☆☆☆ “デイヴィスがディキンスンを描いたことで最高の作品が生まれた” シンシア・ニクソンが、ドラマ「セックス・アンド・ザ・シティ」の ミランダ・ホッブス役とはまったくかけ離れている本作品の主役を 情熱的に演じている素晴らしい作品。 ―ザ・インデペンデント ☆☆☆☆ “テレンス・デイヴィス監督が手がけたディキンスンの伝記映画には細部に渡って美が感じられる” シンシア・ニクソンの素晴らしい演技が光る。 監督は作品を追うごとに素晴らしい作品を生み出している。期待していた通りどのシーンも美しく、 生き生きと描き出されており、役者の台詞１つ１つから強い信念が伝わってくる。 ―ザ・ガーディアン Aランクの作品 “シンシア・ニクソンが素晴らしい” 主演を演じているシンシア・ニクソンはこの伝記映画で首筋の血管が脈打つほどの演技を見せてくれている。彼女は素晴らしい― そして特にイーリーとの相性の良さに引きつけられる。 2011年の作品『愛情は深い海の如く（日本未公開）』でも撮影監督をつとめたフロリアン・ホーフマイスターと再び組んだことで、デイヴィス監督は象徴的な知性溢れるシーンを作り上げている。何ものにも増して首尾一貫している現在７０歳のデイヴィス監督が新たに生み出した繊細な伝記映画にファンも満足することだろう。 ―インディーワイヤー “ニクソンの演技は特別だ（もし公開された年のアカデミー賞に彼女がノミネートされなかったら、私はこの記事を食べよう）” デイヴィスは、ディキンスンの時代に彼女がそうであったように、３０年間、本来受けるべき称賛や支援をほとんど受けてこなかった。彼の最高傑作の１つであり、現代においても素晴らしい作品に数えられる本作で、彼はその評価を得るだろう。もう１度観るのが待ち遠しい― 広く全米で公開されることになるだろう。この作品は旋風を巻き起こすに違いない。 ―ザ・ニューヨーカー “複雑な性格の女性を繊細に描き出した作品” デイヴィス監督作品の多くがそうであるように、この作品にはディキンスンの時代を細部まで再現していることや、まばゆい光の描写、シーンごとに忘れがたい印象を作り出している動きなど、称賛すべきところがたくさんある。そしてニクソンは、この複雑な役を体当たりで演じている。またイーリーとの共演が、より彼女の繊細さを引き出している。撮影監督のフロリアン・ホーフマイスターは魂のこもったアプローチで19世紀の重苦しい熱情を映し出し、それが観る者を飽きさせない調和を生み出している。 ―ハリウッド・リポーター “むしろ壮大で心動かされる伝記映画” じわじわと伝わり、ゆっくりと明らかになることでも引き出されている、この作品の持つパワーは、日々詩作に没頭しその詩に浮世離れした影を落とした女性の肖像を描く上でとても重要だ。 ―スクリーン・インターナショナル 映画『静かなる情熱』公式サイト PAGE TOP,,https://www.facebook.com/dickinsonfilm/,ニュース,https://twitter.com/dickinson_film,Twitter,https://www.facebook.com/dickinsonfilm/,Facebook
http://dickinson-film.jp:80/story/,2017-07-04,ストーリー | 映画『静かなる情熱』公式サイト,19世紀半ばのマサチューセッツ州。家族と離れ、マウント･ホリヨーク女子専門学校に通っていたエミリ･ディキンスンは、学校での福音主義的な教え方に神経質になっていた。そんなエミリを家族が迎えにやってくる。,,ストーリー,,menu ニュース イントロダクション エミリ･ディキンスン ストーリー 海外評 キャスト スタッフ 予告編 劇場情報 Twitter Facebook ストーリー ホーム ストーリー 19世紀半ばのマサチューセッツ州。家族と離れ、マウント･ホリヨーク女子専門学校に通っていたエミリ･ディキンスンは、学校での福音主義的な教え方に神経質になっていた。そんなエミリを家族が迎えにやってくる。弁護士の父親エドワードは彼女をアマストの家に連れ帰り、エミリは両親、兄オースティン、妹ラヴィニア（ヴィニー）らと過ごすこととなった。夜の静寂の中で詩を綴っていたエミリは、父親の口添えもあり、地元の新聞に初めて自身の詩を掲載されるも、当時の編集長からは「女には不朽の名作は書けない」と皮肉な意見を返される。 やがて、彼女は資産家の娘、ヴライリング･バッファムと友人となる。ユーモアにあふれ、進歩的なバッファム嬢にエミリは影響されていく。牧師との祈りの時、跪かなかったことを父親から注意されるもエミリは言い放つ。「私の魂は私のものよ」 ハーバード大学に通っていた兄オースティンが父と一緒に弁護士の仕事をすることになり、美しい花嫁スーザンと隣の家に住むことになる。義姉であるスーザンとの友情、甥の誕生はエミリを喜ばせ、彼女にとって生家より素晴らしい場所は考えられなかった。しかし、外の世界は大きく変わりつつあり、南北戦争は60万人以上の戦死者を生み、奴隷制度は廃止されることになった。 「結婚して家族と離れることは考えられない」と言うエミリだが、心を揺り動かす男性も出現する。ワズワース牧師だ。説教に感動した彼女は彼を自宅に招待するが、彼には妻もいた。ワズワース牧師と自宅の庭を散歩しながら自作の詩を渡す。称賛の言葉を送る牧師に対してエミリは語る。「自分の作品が後世に残ってほしい」と。 一方、親友バッファムの結婚にエミリは大きな喪失感を感じる。ワズワース牧師も別の土地に旅立つことが判明しエミリは衝撃を受ける。そして父親の死。３日間部屋にこもったエミリを心配しヴィニーがドアを開けると、喪中であるにもかかわらず白いドレスを着たエミリがいた。 以降なかなか自分の部屋を出ようとしないエミリはやがてブライト病という不治の病をわずらう。病気がちだった穏やかな性格の母親の死も他界。深い喪失を抱え屋敷に引きこもる生活をつづけながらもエミリは詩作を心のよりどころとしていた—。 映画『静かなる情熱』公式サイト PAGE TOP,,https://www.facebook.com/dickinsonfilm/,ニュース,https://twitter.com/dickinson_film,Twitter,https://www.facebook.com/dickinsonfilm/,Facebook
http://dickinson-film.jp:80/theater/,2017-07-05,劇場情報 | 映画『静かなる情熱』公式サイト,北海道シアターキノ順次公開東京岩波ホール7/29（土）～９/15（金）静岡静岡シネ・ギャラリー9/2（土）～静岡シネマイーラ順次公開愛知名演小劇...,,Theater,,menu ニュース イントロダクション エミリ･ディキンスン ストーリー 海外評 キャスト スタッフ 予告編 劇場情報 Twitter Facebook Theater ホーム 劇場情報 北海道 シアターキノ 順次公開 東京 岩波ホール 7/29（土）～９/15（金） 静岡 静岡シネ・ギャラリー 9/2（土）～ 静岡 シネマイーラ 順次公開 愛知 名演小劇場 8/12（土）～ 岐阜 ＣＩＮＥＸ 順次公開 三重 進富座 9/23（土）～ 大阪 シネ・リーブル梅田 8月12日 京都 京都シネマ 順次公開 兵庫 シネ・リーブル神戸 9 月 2 日 宮崎 宮崎キネマ館 順次公開 鹿児島 ガーデンズシネマ 順次公開 沖縄 シネマパレット 順次公開 映画『静かなる情熱』公式サイト PAGE TOP,,https://www.facebook.com/dickinsonfilm/,ニュース,https://twitter.com/dickinson_film,Twitter,https://www.facebook.com/dickinsonfilm/,Facebook,http://www.theaterkino.net/,シアターキノ,https://www.iwanami-hall.com/,岩波ホール,http://www.cine-gallery.jp/,静岡シネ・ギャラリー,http://cinemae-ra.jp/,シネマイーラ,http://meien.movie.coocan.jp/,名演小劇場,http://www.tochiko.co.jp/,ＣＩＮＥＸ,http://shintomiza.whitesnow.jp/,進富座,http://www.ttcg.jp/cinelibre_umeda/,シネ・リーブル梅田,http://www.kyotocinema.jp/,京都シネマ,http://www.bunkahonpo.or.jp/cinema/,シネ・リーブル神戸,http://www.bunkahonpo.or.jp/cinema/,宮崎キネマ館,http://kagocine.net/,ガーデンズシネマ,http://www.startheaters.jp/cinemapalette/,シネマパレット
http://dickinson-film.jp:80/trailer/,2017-07-05,予告編 | 映画『静かなる情熱』公式サイト,,,Trailer,,menu ニュース イントロダクション エミリ･ディキンスン ストーリー 海外評 キャスト スタッフ 予告編 劇場情報 Twitter Facebook Trailer ホーム 予告編 映画『静かなる情熱』公式サイト PAGE TOP,,https://www.facebook.com/dickinsonfilm/,ニュース,https://twitter.com/dickinson_film,Twitter,https://www.facebook.com/dickinsonfilm/,Facebook
http://www.dickinson-film.jp/,2017-04-19,映画『静かなる情熱 エミリ・ディキンスン』オフィシャルサイト,映画「静かなる情熱 エミリ・ディキンスン」公式サイト 2017年7月29日より 岩波ホールほか 全国順次ロードショー,,,,,
https://dickinson-film.jp/%E3%82%A8%E3%83%9F%E3%83%AA%E3%81%AE%E3%82%88%E3%81%86%E3%81%AB%E9%81%B8%E6%8A%9E%E3%81%99%E3%82%8B%E3%81%AA%E3%82%89verajohn%E3%82%AB%E3%82%B8%E3%83%8E/,2022-01-18,エミリのように自由を選択するならベラジョンカジノでしょ - 映画『静かなる情熱 エミリ･ディキンスン』オフィシャルサイト,,エミリのように自由を選択するならベラジョンカジノでしょ,ベラジョンの無料モードのメリットを挙げますと。。。,,"Skip to content ホーム スタッフ イントロダクション Search Search for: Search 映画『静かなる情熱 エミリ･ディキンスン』オフィシャルサイト ホーム スタッフ イントロダクション Search Search for: Search Home ニュース エミリのように自由を選択するならベラジョンカジノでしょ ニュース エミリのように自由を選択するならベラジョンカジノでしょ By Dickson June 2, 2020 June 2, 2020 オンラインカジノものエミリのように、自由に遊べたらいいなと思ったことはありませんか？ 映画『静かなる情熱 エミリ・ディキンスン』。 映画の舞台は、19世紀を舞台にしていますが、常に自分の心に正直に生きた激情の詩人 エミリは、常識破りで自由な考えを持った女性。主人公エミリは現代社会に生きる我々と似ているものがあります。 そして、オンラインカジノでもエミリのように自由に遊べる事が可能になっています。 オンラインカジノをどこで遊ぼうか選択する際、自由度が高いオンラインカジノを選択肢に入れる人が多くいます。 自由を選択肢に入れるのであれば、 ベラジョン(Vera&John)が非常におすすめ です。 ベラジョンカジノは、有料モードと無料モードがあり、無料モードではアカウント登録する前に、お金を賭けずに遊ぶことができます。 その後、登録するかしないかは自由に決めることが可能です。 ベラジョンの無料モードのメリットを挙げますと。。。 ①どんなカジノゲームがあるのか調べことができる。 有料会員になってから、やりたいゲームがないといったリスクを抑える事ができます。 ②無料会員でもキャンペーン情報を確認する。 お得なキャンペーンなどの情報が手に入るので、有料会員になった後カジノを有利に進めることが可能です。 ③操作に慣れてから本番に挑める。 ゲームの操作や内容を無料体験で確認してから有料会員になれば、どんなゲームが自分に合っているかを把握できます。 ④お金を賭けないのでゲームのルールを覚える手段となる。 オンラインカジノ未経験者でも、ベラジョンカジノは無料でいろいろなゲームのルールを覚えることが可能です。 ⑤無料なので安心感がある。 オンラインカジノが少し怪しいと感じている人でも、無料会員なら安心してゲームをプレイする事ができます。 また、ベラジョンカジノは、トーナメントやイベントが豊富に開催されていますが、参加するか否かはもちろんあなた次第です。 オンラインカジノのプレイヤーには、トーナメントに出場してガッツリ稼ぎたいと思う人や、まったりと自分のペースでプレイしたい人などいますが、ベラジョンカジノは非常に自由なオンラインカジノになっているので自分にあったプレイスタイルで遊ぶことが可能です。 映画『静かなる情熱 エミリ・ディキンスン』のエミリのように、オンラインカジノで自由を求めている人には、ベラジョンカジノはおすすめです。 リヴァプールFCにBons Casinoでベットしよう Back to Top ©2020 Dickinson Film Back to Top &copy;2020 映画『静かなる情熱 エミリ･ディキンスン』オフィシャルサイト",,https://www.japan-101.com/%e3%83%98%e3%82%99%e3%83%a9%e3%82%b7%e3%82%99%e3%83%a7%e3%83%b3%e3%82%ab%e3%82%b7%e3%82%99%e3%83%8e/,ベラジョン(Vera&amp;John)が非常におすすめ
