URL,アーカイブ日,title,meta_description,H1,H2,H3,body_text,備考
http://kanazawa-hp.com/feed/,2026-02-12,,,,,,,
https://kanazawa-hp.com/,2024-05-21,金沢市のホームページ制作会社「TONOSAMA」｜ブランディング・UI/UXデザインのWeb制作,"金沢市のホームページ制作会社「TONOSAMA」では格安の初期8万円～・月額管理費0円でホームページ制作を行っております。UI/UXを意識したデザインのでホームページ制作の会社です。4,000キーワードを超えるSEO対策からリスティング広告などWeb集客もお気軽にご相談ください。。",金沢市のホームページ制作会社。UI/UXデザインを意識したTONOSAMA,CONCEPT | PLAN | STRATEGY | SERVICE | WORKS,金沢のホームページ制作会社「TONOSAMA」の想い | Webをもっと気軽に | 格安のホームページ制作プラン | 月額0円、初期5万円も可能なホームページ制作 | 独自ドメイン | SSL | Googleプレイス | レスポンシブ | 集客に強いWebデザイン | 「格安SEO」１位、リスティング広告500社の実績 | お客様の課題を解決 | ワンストップサービス！全てのサービスが自社対応 | KANAZAWA OFFICE | FUKUI OFFICE,TONOSAMA TOP SERVICE PLAN WORKS FAQ ABOUT CONTACT TOP SERVICE PLAN WORKS FAQ ABOUT CONTACT 金沢市のホームページ制作会社。UI/UXデザインを意識したTONOSAMA CONCEPT 金沢のホームページ制作会社「TONOSAMA」の想い Webを もっと気軽に 金沢をはじめ北陸では、まだまだWebを活用していない企業様が多いのが現状です。 石川県金沢市のホームページ制作会社のTONOSAMAでは「Webをもっと気軽に」をコンセプトに取り組んでいます。 一般的なホームページ制作では高額な初期費用だけでなく月額管理費として月々数万円の維持費が掛かってしまい、１年間で数十万円のコストが掛かってしまいます。弊社では気軽にご利用頂けるよう 全プラン月額管理費０円 のホームページ制作となっています。 見積をした後に営業電話など掛かってくるイメージがありますが、TONOSAMAでは電話営業などの アウト営業を一切行わず Web集客と口コミでご紹介いただいたお客様のみの集客で無駄な経費を省いています。事務所費も含め経費を削減することで全国でも格安の価格でホームページを制作させていただきます。打合せもラフ～な感じのTONOSAMAです。 お気軽に金沢のホームページ制作会社「TONOSAMA」にご相談ください。 PLAN 格安のホームページ制作プラン 月額0円、初期5万円 も可能なホームページ制作 初めてホームページを作成される方は「どんなページが必要？」「どんなコンテンツがいるの？」と分からないことばかりかと思います。金沢市のホームページ制作会社「TONOSAMA」ではWebサイトの企画・設計・ディレクションも含めラフ～な感じで、お気軽にご相談ください。お客様の、ご要望を基に無駄に機能追加の提案をせず、本当に必要なサイト設計、デザインをご提案させて頂きます。 規定のLPでは8万円となりますが問合せフォームを無くし通常のボリュームより短くして５万円で制作の例もあります。少しでも多くの企業様にWebをご利用いただけるように可能な限り柔軟に対応しているTONOSAMAです。 (無茶なご要望は難しいです・・・) ８万円～ リスティング広告、求人ページにオススメ！ LPプラン 12万円～ 全3ページの格安プラン！お急ぎの方に。 テンプレートプラン 20万円～ 起業したばかり・中小企業様に人気のプラン！ オリジナルプラン 25万円～ 簡単な情報配信をしたい方にオススメ！ まめまめプラン 39万円～ 商品、実績のページが自社で追加！ フリープラン 54万円～ 複雑な投稿機能にも対応！充実のHPを制作 わっしょいプラン 独自ドメイン お客様にとって信頼度も高くSEOにも有効な独自ドメインにて設定します。 現在利用中のドメインの利用も可能です。 SSL SSL設定を無料で行います。httpからhttpsへのリダイレクト設定も無料にて対応してます。 ※サーバーによって対応できない場合もございます。 Googleプレイス Googleマップへのサイト登録 から営業時間などを記載するGoogleプレイスの利用方法も無料でお伝えします。 レスポンシブ スマホ化を行う場合は、Google推奨のレスポンシブでホームページを制作させて頂いております。 PLAN STRATEGY 集客に強いWebデザイン 「格安SEO」 １位 、リスティング広告 500社 の実績 金沢のホームページ制作のTONOSAMAは「格安SEO」「格安リスティング広告」と激戦キーワードで1位の実績のある会社です。リスティング広告では整体、ECサイト、結婚相談所など個人企業から上場企業と幅広い会社様の広告を運用代行しています。 SEO対策4000キーワード、リスティング広告500社以上の実績があるTONOSAMAだからこそ豊富なノウハウを基にリスティング広告に効果的なLP制作やSEOを意識したホームページを制作することが可能です。 【ゴールに沿ったランディングページ】 サービスの特徴を分かりやすく伝えるWebデザイン 問合せを意識した配置 ユーザーの導線を考えた設計 【SEOを意識したサイト構造】 ページ遷移を意識したサイト作り 目標キーワードを踏まえた コンテンツページの作成 滞在時間を意識したWebデザイン SERVICE お客様の課題を解決 ワンストップサービス！ 全てのサービスが自社対応 ホームページ制作 ホームページ制作だけでなくチラシ、 ランディングページ制作 も含め幅広く対応しています。 SEO対策 月額2400円～と全国でも格安の価格でSEO対策をご提供しています。 ≫ 格安SEO対策の詳細はコチラ リスティング広告運用 代行手数料が固定費型、運用アカウントは共有するという独自のサービスを展開しています。 システム開発 ポータルサイトなどのシステムから人事の採用管理用のシステムなど対応しています。 SERVICE WORKS TONOSAMAでは金沢をはじめ石川県、東京、大阪と様々な地域にて豊富な制作の実績があるホームページ制作会社です。SEOを意識したサイトから、求人関連、会社のブランディングを目的としたサイトなどお客様の目的をしっかりとヒアリングさせて頂き最適なホームページをご提供しています。 自社で更新を行えるようにシステムを構築するwordpressのCMSのサイトからリスティング広告に効果的なランディングページ、グラフィックデザインやチラシ制作など、お客様に最適なプランをご用意しております。どうしたら良いか分からない方、予算が・・・とお悩みの方も安心してご相談ください。マーケティングのプロがご提案させていただきます！ 守接骨院様 ラウンジ姫様 HASEGAWA様 ユウキホーム様 Sincere Lily様 ㈱佐々木一級建築士事務所様 KIMINOYA様 常盤商事株式会社様 WORKS TOP SERVICE PLAN WORKS FAQ ABOUT CONTACT TONOSAMA KANAZAWA OFFICE 金沢オフィス 〒920-0901 石川県金沢市彦三町1-2-1 FUKUI OFFICE 福井オフィス 〒918-8004 福井県福井市西木田2丁目10-28 営業時間：平日10時～18時 &copy; 2021 金沢のホームページ制作 株式会社TONOSAMA Inc.,
https://kanazawa-hp.com/about.html,2019-07-17,会社概要｜金沢のホームページ制作会社 TONOSAMA,TONOSAMAではWebをもっと気軽に！をコンセプトにサービスをご提供しております。金沢市でホームページ制作をお考えでしたら豊富な実績のTONOSAMAにお気軽にご相談ください。オシャレでかっこいいデザインをご提案いたします。,ABOUT,COMPANY PROFILE | CONTACT,金沢のホームページ制作のTONOSAMAについて | 会社概要 | KANAZAWA OFFICE | FUKUI OFFICE,TONOSAMA TOP SERVICE PLAN WORKS FAQ ABOUT CONTACT TOP SERVICE PLAN WORKS FAQ ABOUT CONTACT ABOUT ホーム ABOUT 金沢のホームページ制作のTONOSAMAについて TONOSAMAは全国のホームページ制作会社・SEO対策・リスティング広告を紹介する一括見積のポータルサイト運営していたスタッフが立ち上げた会社です。ポータルサイトを運営しているときに感じた料金の高さを疑問に思い「もっとWebを気軽に！」をモットーにサービスを開始しました。 ラフ～な感じのTONOSAMAですので、ガチっとした営業マンとの打ち合わせを好まれる場合は正直、他社様にてご相談頂く方が良いかもしれません。ホームページは一緒に創って行くもので、堅くなく気軽に相談できるTONOSAMAでありたいと考えています。 金沢でホームページ制作のことからWeb集客、システム開発のことまで、お気軽にTONOSAMAにご相談ください。 COMPANY PROFILE 会社概要 会社名 株式会社TONOSAMA 代表取締役 山本 昌平 所在地 〒920-0901 石川県金沢市彦三町1-2-1 福井本社 〒918-8003 福井県福井市毛矢2丁目1-9 電話番号 050-5892-7415 設立 2012年7月 営業時間 10:00〜18：00 休業日 土日祝 サービス内容 WEBサイト・ホームページ制作 8万円～の格安ランディングページ（LP）制作 月額2400円～の格安SEO 固定費型の格安リスティング広告運用 バナー広告・リマーケティング広告運用 SNS（Instagram・facebook等）運用 システム開発 自社企画ポータルサイトの運営 サイトURL https://kanazawa-hp.com 福井サイト 福井のホームページ制作サービス CONTACT WEBサイトに関することなら何でもお気軽にお問い合わせください。 販売代理店や業務委託をお考えの制作会社さまもお気軽にご連絡ください。 電話でのお問い合わせ （平日10時～18時） TEL. 050-5892-7415 メールフォームへ TOP SERVICE PLAN WORKS FAQ ABOUT CONTACT TONOSAMA KANAZAWA OFFICE 金沢オフィス 〒920-0901 石川県金沢市彦三町1-2-1 FUKUI OFFICE 福井オフィス 〒918-8003 福井県福井市毛矢2丁目1-9 TEL: 050-5892-7415 営業時間：平日10時～18時 &copy; 2018 金沢のホームページ制作 TONOSAMA Inc.,
https://kanazawa-hp.com/contact.html,2019-07-17,お問い合わせ｜金沢のホームページ制作会社 TONOSAMA,SEO、リスティング広告、システム開発などお気軽にお問い合わせください。金沢市のホームページ制作会社「TONOSAMA」では格安の価格で全国にてご提供しております。ご不明点等ございましたらお気軽にご連絡ください。,CONTACT,,お見積り・ご相談 | KANAZAWA OFFICE | FUKUI OFFICE,"TONOSAMA TOP SERVICE PLAN WORKS FAQ ABOUT CONTACT TOP SERVICE PLAN WORKS FAQ ABOUT CONTACT CONTACT ホーム CONTACT お見積り・ご相談 Web制作・リニューアルまたは、SEO・リスティング広告運用代行などのご依頼・ご相談などございましたら、 お気軽にお電話もしくは下記フォームからお問い合わせ下さい。内容を確認した後、担当者の方からご連絡させて頂きます。 弊社では電話営業や、いきなりお客様先へ訪問するような営業は一切いたしておりませんのでご安心下さいませ。 電話でのお問い合わせ （平日10時～18時） TEL. 050-5892-7415 会社名 お名前 必須 E-mail 必須 TEL ご希望のサービス ホームページ作成 SEO対策 リスティング広告 システム開発 代理店 その他 ご希望のHP制作プラン 制作プランを選択してください LPプラン テンプレートプラン オリジナルプラン まめまめプラン フリープラン わっしょいプラン ページ数 ご予算 ドメイン・サーバー ドメイン・サーバーを選択してください 全てお任せ(初年度18,000円 翌年度6,500円/年) ドメイン・サーバーに関する作業は不要 不明・その他 備考 確認画面へ TOP SERVICE PLAN WORKS FAQ ABOUT CONTACT TONOSAMA KANAZAWA OFFICE 金沢オフィス 〒920-0901 石川県金沢市彦三町1-2-1 FUKUI OFFICE 福井オフィス 〒918-8003 福井県福井市毛矢2丁目1-9 TEL: 050-5892-7415 営業時間：平日10時～18時 &copy; 2018 金沢のホームページ制作 TONOSAMA Inc.",
https://kanazawa-hp.com/faq.html,2019-07-17,よくある質問｜金沢のホームページ制作会社 TONOSAMA,サイト構成など初めての方も安心してご相談ください。石川県金沢市でホームページ制作を行っているTONOSAMAでは初期費用のみの料金プランです!管理費0円と月額無料でHPをご提供しております。お気軽にご相談ください。,FAQ,,よくある質問 | KANAZAWA OFFICE | FUKUI OFFICE,TONOSAMA TOP SERVICE PLAN WORKS FAQ ABOUT CONTACT TOP SERVICE PLAN WORKS FAQ ABOUT CONTACT FAQ ホーム FAQ よくある質問 お客様から、よく頂くご質問を掲載しております。 こちら以外にもご不明な点などございましたら、お手数ですがお電話かお問い合わせフォームよりお問い合わせ下さい。 >お問い合わせフォーム Q. 直接打合せはできますか？ A. 可能です。具体的なイメージが決まっていない方も多くいらっしゃいます。ご要望をお聞きした上でお客様と一緒に ホームページの設計を考えていくこともございます。 Q. メールのみでの対応は可能ですか？ A. 可能です。東京のお客様様など遠方の企業様にてホームページ制作の実績もございますが、 メールのみで完結している例が実際にございます。 Q. 見積は無料ですよね？ A. お見積りは無料です。正式にお申込書を頂くまでは、料金は一切かかりません。 また、お見積り後も不必要な訪問営業や電話営業は一切行っておりません。 Q. 格安SEOで有名なので以前から知っていたのですが何故、そんなに安いのですか？ A. ありがとうございます！一般的に事務所費用は電気代も合わせますと50万円以上するかと思います。弊社の場合、 電気代含めて10万円以内で収めています。集客に関しましても営業マンを雇用しておりませんことと、自社SEOと ご紹介のみでの集客となっていますので他社様よりも無駄なコストが掛かっていないのが一番の大きなポイントか と思います。 Q. 毎月掛かる費用はいくらですか？ A. 月額管理費は0円と一切費用は掛かりません。ホームページの公開に必要なドメイン、サーバーはお客様にてご用意 ください。弊社にて管理をご希望の場合、こちらも月額ではなく年間で6500円となっております。 Q. どのサーバーを選んでも大丈夫ですか？ A. ワードプレスを使用したホームページ制作のプランの場合、サーバー会社でもワードプレスが対応されているプラン をお選び頂く必要がございますのでご注意ください。htmlでの場合、お問合せフォームを設置されますとPHP対応が 必要となりますので、こちらも合わせてご確認されますことをお勧めします。 Q. 画像が無いですが制作の依頼は可能ですか？ A. フリー素材などを利用することでホームページを制作するこが可能です。 お客様のご負担とはなりますが有料素材を利用することも可能です。 Q. 原稿は手書きかデータどちらが良いですか？ A. 記録、データとして保管できますようにテキスト、ワード、エクセルのいずれかでメール添付でお送り下さい。 メール文章で直接ご入力いただき、お送り頂く形でも大丈夫です。 TOP SERVICE PLAN WORKS FAQ ABOUT CONTACT TONOSAMA KANAZAWA OFFICE 金沢オフィス 〒920-0901 石川県金沢市彦三町1-2-1 FUKUI OFFICE 福井オフィス 〒918-8003 福井県福井市毛矢2丁目1-9 TEL: 050-5892-7415 営業時間：平日10時～18時 &copy; 2018 金沢のホームページ制作 TONOSAMA Inc.,
