URL,アーカイブ日,title,meta_description,H1,H2,H3,body_text,備考,発リンク1_URL,発リンク1_テキスト,発リンク2_URL,発リンク2_テキスト,発リンク3_URL,発リンク3_テキスト,発リンク4_URL,発リンク4_テキスト,発リンク5_URL,発リンク5_テキスト,発リンク6_URL,発リンク6_テキスト,発リンク7_URL,発リンク7_テキスト,発リンク8_URL,発リンク8_テキスト,発リンク9_URL,発リンク9_テキスト,発リンク10_URL,発リンク10_テキスト,発リンク11_URL,発リンク11_テキスト,発リンク12_URL,発リンク12_テキスト,発リンク13_URL,発リンク13_テキスト,発リンク14_URL,発リンク14_テキスト,発リンク15_URL,発リンク15_テキスト,発リンク16_URL,発リンク16_テキスト
https://dickinson-film.jp/%E6%83%85%E7%86%B1%E3%82%92%E6%8C%81%E3%81%A3%E3%81%A6%E9%81%8A%E9%9B%85%E5%A0%82%E3%82%92%E3%83%97%E3%83%AC%E3%82%A4%E3%81%97%E3%82%88%E3%81%86/,2022-05-20,エミリのようの情熱を持って遊雅堂をプレイしよう,映画「静かなる情熱 エミリ・ディキンスン」の主人公のように何かに情熱を持って取り組みたくはないですか？そのような方は、ぜひ遊雅堂でプレイしてみてはいかがでしょうか？遊雅堂では思わず夢中になってプレイしたくなるようなゲームがたくさんあります。,エミリのようの情熱を持って遊雅堂をプレイしよう,遊雅堂で情熱を持ってプレイ | より熱中したいならポーカーがおすすめ | エミリのように熱中したいなら遊雅堂でプレイ！,,"Skip to content ホーム スタッフ イントロダクション Search Search for: Search 映画『静かなる情熱 エミリ･ディキンスン』オフィシャルサイト ホーム スタッフ イントロダクション Search Search for: Search Home ニュース エミリのようの情熱を持って遊雅堂をプレイしよう ニュース エミリのようの情熱を持って遊雅堂をプレイしよう By Moyata Dicksson March 16, 2022 March 20, 2022 映画「静かなる情熱 エミリ・ディキンスン」の主人公のように何かに情熱を持って取り組みたくはないですか？ そのような方は、ぜひ遊雅堂でプレイしてみてはいかがでしょうか？遊雅堂では思わず夢中になってプレイしたくなるようなゲームがたくさんあります。 遊雅堂で情熱を持ってプレイ エミリのように何かに情熱を持って取り組みたいのであれば、オンラインカジノの遊雅堂を利用してみるのはいかがでしょうか？ 遊雅堂とは日本語で利用する事ができるオンラインカジノであり、ブラックジャックやポーカー、バカラなどのたくさんの種類のカジノゲームをプレイする事ができます。 オンラインカジノはここ数年で一気に人気が出たサービスであり、日本からも利用者数が急増しています。遊雅堂など日本人向けのオンラインカジノが多数誕生しているので、夢中になってプレイしている人がたくさんいるのです。遊戯堂についての詳しい解説は www.manekinekocasino.com/遊雅堂/ を確認しましょう。 より熱中したいならポーカーがおすすめ 遊雅堂ではたくさんの種類のカジノゲームをプレイする事ができます。それらの中でも特に情熱を注いでプレイしたいのがポーカーです。ポーカーはすでに知っているかもしれませんが、トランプを使用したカジノゲームとなります。ポーカーはスキルがとても重要なカジノゲームであり、経験を積めば積むほど、スキルが身についていきます。 そのため、情熱を持ってプレイしている人がたくさんいるのです。 遊雅堂でもたくさんのポーカーゲームを用意している、スリーカードポーカー、テキサスホールデム、カリピアンスタッドポーカーなど多数のポーカーをプレイする事ができます。 このように遊雅堂ではたくさんの種類のゲームが用意されているので、長く楽しむ事ができるのです。 エミリのように熱中したいなら遊雅堂でプレイ！ 映画「静かなる情熱 エミリ・ディキンスン」のエミリのように何か熱中できるものがあるといいですよね。何か情熱を持って取り組めるものを探しているという方に遊雅堂は最適であり、ポーカーをはじめとした多くのゲームをプレイする事ができます。ぜひいますぐ遊雅堂に登録して、熱中できるカジノゲームを見つけましょう。 リヴァプールFCにBons Casinoでベットしよう Back to Top ©2020 Dickinson Film Back to Top &copy;2020 映画『静かなる情熱 エミリ･ディキンスン』オフィシャルサイト",,https://www.manekinekocasino.com/%e9%81%8a%e9%9b%85%e5%a0%82/,www.manekinekocasino.com/遊雅堂/
https://dickinson-film.jp/%e3%83%aa%e3%83%b4%e3%82%a1%e3%83%97%e3%83%bc%e3%83%abfc%e3%81%abbonscasino%e3%81%a7%e3%83%99%e3%83%83%e3%83%88%e3%81%97%e3%82%88%e3%81%86/,2022-01-18,リヴァプールFCにBons Casinoでベットしよう,監督・脚本：テレンス・デイヴィスは、イギリス、イングランド、リヴァプール生まれ。リヴァプールといえば、やはり人気のサッカークラブであるリヴァプールFCを連想する人が多いことでしょう。スポーツベッティングでリヴァプールFCを応援してみませんか？,リヴァプールFCにBons Casinoでベットしよう,「静かなる情熱」脚本家の出身地・リヴァプール | リヴァプールFCとスポーツベッティング | 「静かなる情熱」脚本家の出身地・リヴァプールは、スポーツベッティングにもぴったり,,"Skip to content ホーム スタッフ イントロダクション Search Search for: Search 映画『静かなる情熱 エミリ･ディキンスン』オフィシャルサイト ホーム スタッフ イントロダクション Search Search for: Search Home ニュース リヴァプールFCにBons Casinoでベットしよう ニュース リヴァプールFCにBons Casinoでベットしよう By Moyata Dicksson December 17, 2021 December 6, 2021 監督・脚本：テレンス・デイヴィスは、イギリス、イングランド、リヴァプール生まれ。リヴァプールといえば、やはり人気のサッカークラブであるリヴァプールFCを連想する人が多いことでしょう。 「静かなる情熱」脚本家の出身地・リヴァプール 「静かなる情熱」の脚本家兼監督を務めたテレンス・デイヴィスは、イングランドのリヴァプール出身です。 リヴァプールは、イギリス・イングランド北西部マージーサイド州の中心都市で、かつてはイギリスの主要な港湾都市でした。 そんなリヴァプールといえば、やはりリヴァプールFCでしょう。リヴァプールFCは、イングランド・リヴァプールをホームタウンとするサッカークラブであり、イングランドプロサッカーリーグ（プレミアリーグ）に加盟しています。 イギリスでは、毎年サッカーが注目されており、スポーツベッティングもかなり盛り上がっています。 リヴァプールFCとスポーツベッティング スポーツベッティングとは、スポーツの結果に対してベットするイギリス発祥のギャンブルです。「静かなる情熱」脚本家の出身地であるリヴァプールを含み、スポートベッティングはイギリス全土で楽しまれています。 スポーツベッティングは、ブックメーカーに登録することで誰でも利用することができます。かつてはイギリス発のブックメーカーが市場を占領していましたが、現在では多くの国からブックメーカーが誕生し、オンラインカジノでもスポーツベッティングを提供するようになってきています。その例として挙げられるのがボンズカジノです。ボンズカジノは元はオンラインカジノでしたが、最近になってスポーツベッティングにも対応するようになってきています。 日本語対応のボンズカジノ であれば、誰でも気軽に利用することができます。 ボンズカジノを含むオンラインカジノ、ブックメーカーでは、リヴァプールFCが加盟するプレミアリーグの試合にベットすることができます。 リヴァプールFCは人気のサッカークラブであり、世界中のサッカーファンが注目します。オッズも多数設定されるため、一攫千金のチャンスもあります。 「静かなる情熱」脚本家の出身地・リヴァプールは、スポーツベッティングにもぴったり 「静かなる情熱」脚本家の出身地であるリヴァプールは、有名サッカークラブがあることから、スポーツベッティング好きもたくさんいます。 「静かなる情熱」を鑑賞し終えた後は、さらにイギリスの雰囲気を味わうために、ボンズカジノなどでスポーツベッティングを楽しむのもいいでしょう。 エミリのように自由を選択するならベラジョンカジノでしょ Back to Top ©2020 Dickinson Film Back to Top &copy;2020 映画『静かなる情熱 エミリ･ディキンスン』オフィシャルサイト",,https://www.6takarakuji.com/casino/bons/,日本語対応のボンズカジノ
https://dickinson-film.jp/author/ddiggityfilm/,2022-01-18,"Dickson, Author at 映画『静かなる情熱 エミリ･ディキンスン』オフィシャルサイト",,Author: Dickson,エミリのように自由を選択するならベラジョンカジノでしょ,,"Skip to content ホーム スタッフ イントロダクション Search Search for: Search 映画『静かなる情熱 エミリ･ディキンスン』オフィシャルサイト ホーム スタッフ イントロダクション Search Search for: Search Home Articles posted by Dickson Author: Dickson ニュース エミリのように自由を選択するならベラジョンカジノでしょ By Dickson June 2, 2020 June 2, 2020 オンラインカジノものエミリのように、自由に遊べたらいいなと思ったことはありませんか？ 映画『静かなる情熱 エミリ・ディキンスン』。 映画の舞台は、19世紀を舞台にしていますが、常に自分の心に正直に生きた激情の詩人 エミリは、常識破りで自由な考えを持った女性。主人公エミリは現代社会に生きる我々と似ているものがあります。 そして、オンラインカジノでもエミリのように自由に遊べる事が可能になっています。 オンラインカジノをどこで遊ぼうか選択する際、自由度が高いオンラインカジノを選択肢に入れる人が多くいます。 自由を選択肢に入れるのであれば、ベラジョン(Vera&John)が非常におすすめです。 ベラジョンカジノは、有料モードと無料モードがあり、無料モードではアカウント登録する前に、お金を賭けずに遊ぶことができます。 その後、登録するかしないかは自由に決めることが可能です。 ベラジョンの無料モードのメリットを挙げますと。。。 ①どんなカジノゲームがあるのか調べことができる。 有料会員になってから、やりたいゲームがないといったリスクを抑える事ができます。 ②無料会員でもキャンペーン情報を確認する。 お得なキャンペーンなどの情報が手に入るので、有料会員になった後カジノを有利に進めることが可能です。 ③操作に慣れてから本番に挑める。 ゲームの操作や内容を無料体験で確認してから有料会員になれば、どんなゲームが自分に合っているかを把握できます。 ④お金を賭けないのでゲームのルールを覚える手段となる。 オンラインカジノ未経験者でも、ベラジョンカジノは無料でいろいろなゲームのルールを覚えることが可能です。 ⑤無料なので安心感がある。 オンラインカジノが少し怪しいと感じている人でも、無料会員なら安心してゲームをプレイする事ができます。 また、ベラジョンカジノは、トーナメントやイベントが豊富に開催されていますが、参加するか否かはもちろんあなた次第です。 オンラインカジノのプレイヤーには、トーナメントに出場してガッツリ稼ぎたいと思う人や、まったりと自分のペースでプレイしたい人などいますが、ベラジョンカジノは非常に自由なオンラインカジノになっているので自分にあったプレイスタイルで遊ぶことが可能です。 映画『静かなる情熱 エミリ・ディキンスン』のエミリのように、オンラインカジノで自由を求めている人には、ベラジョンカジノはおすすめです。 Read more ""エミリのように自由を選択するならベラジョンカジノでしょ"" Back to Top ©2020 Dickinson Film Back to Top &copy;2020 映画『静かなる情熱 エミリ･ディキンスン』オフィシャルサイト",
https://dickinson-film.jp/author/moyata/,2022-01-18,"Moyata Dicksson, Author at 映画『静かなる情熱 エミリ･ディキンスン』オフィシャルサイト",,Author: Moyata Dicksson,リヴァプールFCにBons Casinoでベットしよう,,"Skip to content ホーム スタッフ イントロダクション Search Search for: Search 映画『静かなる情熱 エミリ･ディキンスン』オフィシャルサイト ホーム スタッフ イントロダクション Search Search for: Search Home Articles posted by Moyata Dicksson Author: Moyata Dicksson ニュース リヴァプールFCにBons Casinoでベットしよう By Moyata Dicksson December 17, 2021 December 6, 2021 監督・脚本：テレンス・デイヴィスは、イギリス、イングランド、リヴァプール生まれ。リヴァプールといえば、やはり人気のサッカークラブであるリヴァプールFCを連想する人が多いことでしょう。 「静かなる情熱」脚本家の出身地・リヴァプール 「静かなる情熱」の脚本家兼監督を務めたテレンス・デイヴィスは、イングランドのリヴァプール出身です。 リヴァプールは、イギリス・イングランド北西部マージーサイド州の中心都市で、かつてはイギリスの主要な港湾都市でした。 そんなリヴァプールといえば、やはりリヴァプールFCでしょう。リヴァプールFCは、イングランド・リヴァプールをホームタウンとするサッカークラブであり、イングランドプロサッカーリーグ（プレミアリーグ）に加盟しています。 イギリスでは、毎年サッカーが注目されており、スポーツベッティングもかなり盛り上がっています。 リヴァプールFCとスポーツベッティング スポーツベッティングとは、スポーツの結果に対してベットするイギリス発祥のギャンブルです。「静かなる情熱」脚本家の出身地であるリヴァプールを含み、スポートベッティングはイギリス全土で楽しまれています。 スポーツベッティングは、ブックメーカーに登録することで誰でも利用することができます。かつてはイギリス発のブックメーカーが市場を占領していましたが、現在では多くの国からブックメーカーが誕生し、オンラインカジノでもスポーツベッティングを提供するようになってきています。その例として挙げられるのがボンズカジノです。ボンズカジノは元はオンラインカジノでしたが、最近になってスポーツベッティングにも対応するようになってきています。日本語対応のボンズカジノであれば、誰でも気軽に利用することができます。 ボンズカジノを含むオンラインカジノ、ブックメーカーでは、リヴァプールFCが加盟するプレミアリーグの試合にベットすることができます。 リヴァプールFCは人気のサッカークラブであり、世界中のサッカーファンが注目します。オッズも多数設定されるため、一攫千金のチャンスもあります。 「静かなる情熱」脚本家の出身地・リヴァプールは、スポーツベッティングにもぴったり 「静かなる情熱」脚本家の出身地であるリヴァプールは、有名サッカークラブがあることから、スポーツベッティング好きもたくさんいます。 「静かなる情熱」を鑑賞し終えた後は、さらにイギリスの雰囲気を味わうために、ボンズカジノなどでスポーツベッティングを楽しむのもいいでしょう。 Read more ""リヴァプールFCにBons Casinoでベットしよう"" Back to Top ©2020 Dickinson Film Back to Top &copy;2020 映画『静かなる情熱 エミリ･ディキンスン』オフィシャルサイト",
https://dickinson-film.jp/category/%E3%83%8B%E3%83%A5%E3%83%BC%E3%82%B9/,2022-01-18,ニュース Archives - 映画『静かなる情熱 エミリ･ディキンスン』オフィシャルサイト,,Category: ニュース,リヴァプールFCにBons Casinoでベットしよう | エミリのように自由を選択するならベラジョンカジノでしょ,,"Skip to content ホーム スタッフ イントロダクション Search Search for: Search 映画『静かなる情熱 エミリ･ディキンスン』オフィシャルサイト ホーム スタッフ イントロダクション Search Search for: Search Home Archive for category ""ニュース"" Category: ニュース ニュース リヴァプールFCにBons Casinoでベットしよう By Moyata Dicksson December 17, 2021 December 6, 2021 監督・脚本：テレンス・デイヴィスは、イギリス、イングランド、リヴァプール生まれ。リヴァプールといえば、やはり人気のサッカークラブであるリヴァプールFCを連想する人が多いことでしょう。 「静かなる情熱」脚本家の出身地・リヴァプール 「静かなる情熱」の脚本家兼監督を務めたテレンス・デイヴィスは、イングランドのリヴァプール出身です。 リヴァプールは、イギリス・イングランド北西部マージーサイド州の中心都市で、かつてはイギリスの主要な港湾都市でした。 そんなリヴァプールといえば、やはりリヴァプールFCでしょう。リヴァプールFCは、イングランド・リヴァプールをホームタウンとするサッカークラブであり、イングランドプロサッカーリーグ（プレミアリーグ）に加盟しています。 イギリスでは、毎年サッカーが注目されており、スポーツベッティングもかなり盛り上がっています。 リヴァプールFCとスポーツベッティング スポーツベッティングとは、スポーツの結果に対してベットするイギリス発祥のギャンブルです。「静かなる情熱」脚本家の出身地であるリヴァプールを含み、スポートベッティングはイギリス全土で楽しまれています。 スポーツベッティングは、ブックメーカーに登録することで誰でも利用することができます。かつてはイギリス発のブックメーカーが市場を占領していましたが、現在では多くの国からブックメーカーが誕生し、オンラインカジノでもスポーツベッティングを提供するようになってきています。その例として挙げられるのがボンズカジノです。ボンズカジノは元はオンラインカジノでしたが、最近になってスポーツベッティングにも対応するようになってきています。日本語対応のボンズカジノであれば、誰でも気軽に利用することができます。 ボンズカジノを含むオンラインカジノ、ブックメーカーでは、リヴァプールFCが加盟するプレミアリーグの試合にベットすることができます。 リヴァプールFCは人気のサッカークラブであり、世界中のサッカーファンが注目します。オッズも多数設定されるため、一攫千金のチャンスもあります。 「静かなる情熱」脚本家の出身地・リヴァプールは、スポーツベッティングにもぴったり 「静かなる情熱」脚本家の出身地であるリヴァプールは、有名サッカークラブがあることから、スポーツベッティング好きもたくさんいます。 「静かなる情熱」を鑑賞し終えた後は、さらにイギリスの雰囲気を味わうために、ボンズカジノなどでスポーツベッティングを楽しむのもいいでしょう。 Read more ""リヴァプールFCにBons Casinoでベットしよう"" ニュース エミリのように自由を選択するならベラジョンカジノでしょ By Dickson June 2, 2020 June 2, 2020 オンラインカジノものエミリのように、自由に遊べたらいいなと思ったことはありませんか？ 映画『静かなる情熱 エミリ・ディキンスン』。 映画の舞台は、19世紀を舞台にしていますが、常に自分の心に正直に生きた激情の詩人 エミリは、常識破りで自由な考えを持った女性。主人公エミリは現代社会に生きる我々と似ているものがあります。 そして、オンラインカジノでもエミリのように自由に遊べる事が可能になっています。 オンラインカジノをどこで遊ぼうか選択する際、自由度が高いオンラインカジノを選択肢に入れる人が多くいます。 自由を選択肢に入れるのであれば、ベラジョン(Vera&John)が非常におすすめです。 ベラジョンカジノは、有料モードと無料モードがあり、無料モードではアカウント登録する前に、お金を賭けずに遊ぶことができます。 その後、登録するかしないかは自由に決めることが可能です。 ベラジョンの無料モードのメリットを挙げますと。。。 ①どんなカジノゲームがあるのか調べことができる。 有料会員になってから、やりたいゲームがないといったリスクを抑える事ができます。 ②無料会員でもキャンペーン情報を確認する。 お得なキャンペーンなどの情報が手に入るので、有料会員になった後カジノを有利に進めることが可能です。 ③操作に慣れてから本番に挑める。 ゲームの操作や内容を無料体験で確認してから有料会員になれば、どんなゲームが自分に合っているかを把握できます。 ④お金を賭けないのでゲームのルールを覚える手段となる。 オンラインカジノ未経験者でも、ベラジョンカジノは無料でいろいろなゲームのルールを覚えることが可能です。 ⑤無料なので安心感がある。 オンラインカジノが少し怪しいと感じている人でも、無料会員なら安心してゲームをプレイする事ができます。 また、ベラジョンカジノは、トーナメントやイベントが豊富に開催されていますが、参加するか否かはもちろんあなた次第です。 オンラインカジノのプレイヤーには、トーナメントに出場してガッツリ稼ぎたいと思う人や、まったりと自分のペースでプレイしたい人などいますが、ベラジョンカジノは非常に自由なオンラインカジノになっているので自分にあったプレイスタイルで遊ぶことが可能です。 映画『静かなる情熱 エミリ・ディキンスン』のエミリのように、オンラインカジノで自由を求めている人には、ベラジョンカジノはおすすめです。 Read more ""エミリのように自由を選択するならベラジョンカジノでしょ"" Back to Top ©2020 Dickinson Film Back to Top &copy;2020 映画『静かなる情熱 エミリ･ディキンスン』オフィシャルサイト",
