URL,アーカイブ日,title,meta_description,H1,H2,H3,body_text,備考,発リンク1_URL,発リンク1_テキスト,発リンク2_URL,発リンク2_テキスト,発リンク3_URL,発リンク3_テキスト,発リンク4_URL,発リンク4_テキスト,発リンク5_URL,発リンク5_テキスト,発リンク6_URL,発リンク6_テキスト,発リンク7_URL,発リンク7_テキスト,発リンク8_URL,発リンク8_テキスト,発リンク9_URL,発リンク9_テキスト,発リンク10_URL,発リンク10_テキスト,発リンク11_URL,発リンク11_テキスト,発リンク12_URL,発リンク12_テキスト,発リンク13_URL,発リンク13_テキスト,発リンク14_URL,発リンク14_テキスト,発リンク15_URL,発リンク15_テキスト,発リンク16_URL,発リンク16_テキスト
http://dickinson-film.jp/web/wp-admin/admin-ajax.php,2017-07-12,,,,,,0,
http://dickinson-film.jp:80/%E3%82%B9%E3%82%BF%E3%83%83%E3%83%95/,2017-07-04,スタッフ | 映画『静かなる情熱』公式サイト,監督・脚本：テレンス・デイヴィスTerence Davis1945年11月10日、イギリス、イングランド、リヴァプール生まれ。監督・脚本家。すべての監督作において自身で脚本を担当している。自伝的要素を含む作風が多い。,,Staff,,menu ニュース イントロダクション エミリ･ディキンスン ストーリー 海外評 キャスト スタッフ 予告編 劇場情報 Twitter Facebook Staff ホーム スタッフ 監督・脚本：テレンス・デイヴィス Terence Davis 1945年11月10日、イギリス、イングランド、リヴァプール生まれ。監督・脚本家。すべての監督作において自身で脚本を担当している。自伝的要素を含む作風が多い。2007年より権威ある英国映画協会会員。中編３部作『テレンス・デイヴィスのトリロジー』が成功した後、初長編作『遠い声、静かな暮し』（88）でカンヌ国際映画祭にて国際映画批評家連盟賞受賞をはじめ批評家より高い評価を得る。また同作は2011年「タイムアウト」誌にて英国150人の映画産業の専門家や文化人達によって“最も偉大なイギリス映画”ランキング第３位に選ばれている。 2作目『長い日が終わる』（9２/日本未公開）、３作目『ネオン・バイブル』(95)はカンヌ国際映画祭コンペティション部門ノミネート。続いてイーディス・ウォートンの同名小説を原作とした『歓楽の家』（00/日本未公開）を発表。2008年には故郷リヴァプールを扱ったドキュメンタリー『時と街について』（08/日本未公開）がカンヌ国際映画祭アウト・オブ・コンペティション部門にてプレミア上映される。 その他の近年の作品に『愛情は深い海の如く』（11/日本未公開）、ルイス・グラシック・ギボン原作の『夕暮れの歌』(15/日本未公開)など。 プロデューサー：ロイ・ボウルター Roy Boulter 1964年7月2日、イギリス、イングランド、リヴァプール生まれ。元ミュージシャン。全英アルバムチャート1位に輝いたこともあるバンド「ザ・ファーム」のドラムスを担当していた。その後脚本家に転身し、130以上ものテレビ番組に携わる。2001年にハリケーン・フィルムズのディレクターとなり、フリーでのテレビやラジオの脚本の仕事のかたわら、自社製作作品で脚本、プロデュースなど担当する。主な作品に英国アカデミー賞ドラマ部門やエミー賞で受賞歴のあるテレビシリーズ「The Street」など。ソル・パパドパウロスとはじめて共同プロデュースしたテレンス・デイヴィス監督の『時と街について』(08/日本未公開)で英国アカデミー賞新人プロデューサー賞ノミネート。 プロデューサー：ソル・パパドパウロス Sol Papadopoulos スチール・カメラマンからイギリスのナショナル・フィルム・スクールの16mmコースで映像を学び、フリーランスとしてすべての主要な放送局でドキュメンタリーやショート・ドラマを製作する。2000年3月、ハリケーン・フィルムズを設立。ドキュメンタリー、フィクション問わず、世界中の映像を優れた作品に昇華させている。王立テレビ協会賞に６度、英国アカデミー賞に２度のノミネート。ロイ・ボウルターと共同プロデュースのテレンス・デイヴィス監督作は『時と街について』、『夕暮れの歌』に続き本作で３作目。 撮影監督：フロリアン・ホーフマイスター Florian Hoffmeister 1970年、ドイツ、ブラウンシュヴァイク生まれ。ドイツ映画テレビ・アカデミーで演出と撮影を学ぶ。2014年「バラエティ」誌の“観るべき10人のカメラマン”に選ばれた注目の撮影監督。人気のテレビシリーズを多数手がけており、主な作品は英国アカデミー賞にノミネートされた「サダム 野望の帝国」（08）、エミー賞にノミネートされた「５デイズ」（07）、「プリズナーNo.6」(09)など。主な映画作品は『ワン・デイ・イン・ヨーロッパ』（05）、『愛情は深い海の如く』（11日本未公開）、『チャーリー・モルデカイ 華麗なる名画の秘密』（15）など。監督としても活躍。最新作はユリア・イエンチ主演の『Die Habenichtse』(16/日本未公開)。 美術監督：ムージェン・セップ Merijn Sep アート・ディレクターとして携わった主な作品にベネディクト・カンバーバッチ、レベッカ・ホール出演のイギリスBBC Two、アメリカHBO制作テレビドラマ「パレーズ・エンド」（12）、BBC制作のテレビドラマ「ザ・ミッシング」（14）など。 衣装デザイン：カトリーヌ・マルシャン Catherine Marchand ベルギー生まれ。ベルギー国立高等芸術学校で学ぶ。1984年よりキャリアをスタート。『オルメイヤーの阿房宮』（11/日本未公開）でベルギー・アカデミー賞衣装賞ノミネート、『Vijay and I』(13)と『Marina』(13)では同賞最優秀衣装賞受賞。他携わった主な作品に『タンゴ・リブレ 君を想う』(12)、『リリーのすべて』(15)など。 映画『静かなる情熱』公式サイト PAGE TOP,,https://www.facebook.com/dickinsonfilm/,ニュース,https://twitter.com/dickinson_film,Twitter,https://www.facebook.com/dickinsonfilm/,Facebook
http://dickinson-film.jp:80/books/,2017-08-04,映画『静かなる情熱 エミリ･ディキンスン』オフィシャルサイト,映画『静かなる情熱 エミリ･ディキンスン』オフィシャルサイト。2017年7月29日より岩波ホール他全国順次 ロードショー。これは世界にあてた私の手紙です。私に一度も手紙をくれたことのない 世界への,,Books,,menu ニュース 作品情報 イントロダクション エミリ･ディキンスン ストーリー コメント 海外評 関連書籍 キャスト＆スタッフ キャスト スタッフ 予告編 劇場情報 Twitter Facebook Books ホーム Books 映画『静かなる情熱 エミリ･ディキンスン』公式サイト PAGE TOP,,https://www.facebook.com/dickinsonfilm/,ニュース,https://twitter.com/dickinson_film,Twitter,https://www.facebook.com/dickinsonfilm/,Facebook
http://dickinson-film.jp:80/cast/,2017-07-04,キャスト | 映画『静かなる情熱』公式サイト,エミリ･ディキンスンシンシア･ニクソン / Cynthia Nixon1966年4月9日、アメリカ、ニューヨーク州ニューヨーク・シティ生まれ。1980年、14歳のときに舞台「フィラデルフィア物語」でブロードウェイデビュー。,,Cast,,menu ニュース イントロダクション エミリ･ディキンスン ストーリー 海外評 キャスト スタッフ 予告編 劇場情報 Twitter Facebook Cast ホーム キャスト エミリ･ディキンスン シンシア･ニクソン / Cynthia Nixon 1966年4月9日、アメリカ、ニューヨーク州ニューヨーク・シティ生まれ。1980年、14歳のときに舞台「フィラデルフィア物語」でブロードウェイデビュー。同年、テイタム・オニール主演作『リトル･ダーリング』(80)で映画デビューも果たす。 これらの成功に続き、ブロードウェイで２つの舞台、トム・ストッパード作「The Real Thing」とデイヴィッド・レイブ作「Hurlyburly」に同時に出演。1995年には舞台「Indiscretions」でトニー賞演劇部門主演女優賞に初ノミネートする。 1998年より出演する大ヒットテレビドラマシリーズ「セックス･アンド・ザ・シティ」では主要キャストの一人、クールな弁護士ミランダ役で世界的にファンを獲得。同役で2004年にエミー賞コメディ部門助演女優賞を初受賞。引き続き舞台と映画の両方で才能を発揮し、2005年にはテレビ映画『ルーズベルト 大統領の保養地』で視聴者からも批評家からも絶賛され、2006年にはブロードウェイの舞台「ラビット・ホール」で悲しみに打たれた母親を演じトニー賞演劇部門主演女優賞を初受賞する。 2008年、テレビドラマシリーズ「LAW & ORDER:犯罪心理捜査班」へのゲスト出演に対して２度目のエミー賞を受賞。翌2009年、朗読を担当したアル・ゴアの『不都合な真実』オーディオブックにてグラミー賞を受賞した。2012年にはマーガレット・ハドソンの初戯曲「ウィット」でトニー賞演劇部門主演女優賞に３度目のノミネート。1998年から2004年にかけてシーズン１～６まで放送された「セックス・アンド・ザ・シティ」はゴールデングローブ賞テレビドラマ部門作品賞(ミュージカル・コメディ部門)24回ノミネートされ、8回受賞、社会現象となる。2008年『セックス・アンド・ザ・シティ』、2011年『セックス・アンド・ザ・シティ２』と２度の映画化。 現在、待望の劇場版第３弾の撮影が開始されると報じられている。その他の近年の日本公開作に『ニューヨーク 眺めのいい部屋売ります』（14）など。 ラヴィニア（ヴィニー）・ディキンスン ジェニファー・イーリー / Jennifer Ehle 1969年12月29日、アメリカ、ノースカロライナ州、ウインストン・セーラム生まれ。主にイギリスで活躍。父親は作家のジョン・イーリー、母親はイギリスの女優ローズマリー・ハリス。子役時代より舞台俳優としてキャリアをスタート。 2000年、ブロードウェイの舞台トム・ストッパード作「The Real Thing」のリバイバル上演で1度目のトニー賞演劇部門主演女優賞を受賞。2007年、同じくトム・ストッパード作による3部構成、上演時間6時間に及ぶ歴史大作『コースト・オブ・ユートピア』で３役を演じ、再びトニー賞演劇部門助演女優賞を受賞した。 映像作品ではイギリスBBCにて放映されたテレビドラマシリーズ、ジェーン・オースティン原作の時代劇「高慢と偏見」にてコリン・ファースと共演。同作で英国映画テレビ芸術アカデミー賞テレビ部門にて1996年、最優秀主演女優賞を受賞。 『オスカー・ワイルド』(97)で1998年、再び英国アカデミー賞助演女優賞にノミネート。そしてサボー・イシュトヴァーン監督作『太陽の雫』（99）で批評家から広く絶賛される。 近年の出演作にトム・フーパ―監督作『英国王のスピーチ』(10)、ジョージ・クルーニー監督作『スーパー・チューズデー 〜正義を売った日〜』（11）、スティーブン・ソダーバーグ監督作『コンテイジョン』(11)、キャスリン・ビグロー監督作『ゼロ・ダーク・サーティー』（12）、他『ヴェルサイユの宮廷庭師』（14）、『フィフティ・シェイズ・オブ・グレイ』(15)など。 エドワード・ディキンスン キース・キャラダイン / Keith Carradine 1949年8月8日、アメリカ、カリフォルニア州サンマテオ生まれ。舞台や映画、TVで幅広く活躍し、70以上の映画、5つのブロードウェイの舞台に出演。また２枚のLPレコードアルバムを出すなど、歌手・作曲家の顔も持つ。 俳優のジョン・キャラダインを父に、同じく俳優のデヴィッド・キャラダインを兄に、ロバート・キャラダインを弟に持つ。コロラド州立大学で演劇を専攻するが、その後中退した。舞台に出演するようになり、ブロードウェイのミュージカル『ヘアー』に出演。そこで出会った女優のシェリー・プリンプトンとの間に娘マーサが生まれる。1971年にロバート・アルトマン監督の『ギャンブラー』(71)で映画デビュー。同監督作品に多く出演し、『ナッシュビル』(75)では、自作曲「I Am Easy」を歌い、1976年にはアカデミー歌曲賞を受賞している。 1984年にはマドンナの「マテリアル・ガール」のPVにも出演した。他にウォルター・ヒル監督作『ロング・ライダーズ』(80)やアラン・ルドルフ監督作『モダーンズ』(88)で知られる。1991年にはブロードウェイ・ミュージカル「ウィル・ロジャーズ・フォーリーズ」でトニー賞主演男優賞にノミネート。 2013年、ミュージカル「ハンズ・オン・ア・ハードボディ」で再びトニー賞ノミネート。近年の映画出演作に『カウボーイ＆エイリアン』(11)、『セインツー約束の果て―』（13）など。 スーザン・ギルバート ジョディ・メイ / Jodhi May 1975年5月8日、イギリス、ロンドン生まれ。オックスフォード大学で英語を学ぶ。舞台、映画、テレビで幅広く活躍。 13歳で『ワールド・アパート』（88）で映画デビュー。同作は第41回カンヌ国際映画祭審査員特別グランプリを受賞し、バーバラ・ハーシー、リンダ・ムブシとともに女優賞をカンヌ史上最年少で受賞。 その他の主な映画出演作に『ラスト・オブ・モヒカン』（92）、『レンブラントの夜警』（07）、『ディファイアンス』(08)、『ジンジャーの朝～さよなら、わたしが愛した世界』（12）など。 ヴライリング・バッファム キャサリン・ベイリー / Catherine Bailey 1980年1月2日、イギリス、ロンドン生まれ。12歳で演技の道へ進み、BBCのテレビシリーズ「Uncle Jack and Cleopatras Mummy」で主演をつとめる。 15歳でロイヤル・シェイクスピア・カンパニーでトム・サプル演出のミュージカル「春のめざめ」に出演。以後、主にテレビと舞台でコンスタントにキャリアを重ねる。近年はグローブ座の舞台に立つことが多く、シェイクスピア作品「ジュリアス・シーザー」「ベニスの商人」やハワード・ブレントンの新作戯曲「Doctor Scroggys War」などに出演した。 若き日のエミリ・ディキンスン エマ・ベル / Emma Bell 1986年12月17日、アメリカ、ニュージャージー州ウッズタウン生まれ。 16歳のときに女優を志してニューヨークに移り、ハイスクール・オブ・パフォーミング・アーツに学ぶ。 大ヒットテレビシリーズに多数出演。主な映画出演作は『フローズン』（10）、『ファイナル・デッドブリッジ』(11)など。2010年、「Ｎｙｌｏｎ」誌にて“未来の顔55人”に選出。2016年には短編映画『Scratch』を初監督した。 オースティン・ディキンスン ダンカン・ダフ / Duncan Duff 1964年2月8日、イギリス、スコットランド、エディンバラ生まれ。リヴァプール大学で歴史を学んだ後、俳優の道を志し王立演劇学校で学ぶ。 ナショナル・シアター、ドンマー・ウェアハウス、ロイヤルコートシアターなどロンドンの数々の舞台に立つほか、シアター・カンパニーとヨーロッパ、アジア、南米を巡業。 舞台のほかテレビやビデオゲームの声優としても活躍。映画にも長編、短編問わず出演し、2007年の「The Girls」で英国インディペンデント映画賞にノミネート。 映画『静かなる情熱』公式サイト PAGE TOP,,https://www.facebook.com/dickinsonfilm/,ニュース,https://twitter.com/dickinson_film,Twitter,https://www.facebook.com/dickinsonfilm/,Facebook
http://dickinson-film.jp:80/comment/,2017-08-04,映画『静かなる情熱 エミリ･ディキンスン』オフィシャルサイト,映画『静かなる情熱 エミリ･ディキンスン』オフィシャルサイト。2017年7月29日より岩波ホール他全国順次 ロードショー。これは世界にあてた私の手紙です。私に一度も手紙をくれたことのない 世界への,,Comment,,menu ニュース 作品情報 イントロダクション エミリ･ディキンスン ストーリー コメント 海外評 関連書籍 キャスト＆スタッフ キャスト スタッフ 予告編 劇場情報 Twitter Facebook Comment ホーム Comment エミリと同じ部屋にいるような緊迫感、 詩にひそむドラマがここまでリアルな映像になった驚き！ 谷川俊太郎（詩人） 言葉が、肉体からも時間からも自由になるさまを見た。 それが詩というものだと思う。 俵万智（歌人） すでにして名作。映画館の数週間だけでなく、この先ずっと鑑賞されるだろう。 池澤夏樹（作家）＜「図書」8月号より＞ 社会のありようを丹念に描いたから、 詩を書かねばならない、引きこもらねばならない 詩人の生きざまがひしひしと伝わってきた。 そして主役の女優がすごい！ 伊藤比呂美（詩人） 生きづらさ爆発の女性詩人エミリ。 試練によって彼女の言葉は磨かれます。 幸せに浸っている人の詩なんて読んでも おもしろくありません。不幸は創造性の源です。 辛酸なめ子（漫画家、コラムニスト） 目をこらさないと聞こえてこないもの、耳をすまさないと見えてこないものがある。 この映画はその大切さを教えてくれる。 ディキンスンの詩の魅力を文章で伝えるのはとても難しい。 それをこの映画は驚くほどわかりやすく、そして感動的に伝えてくれている。 金原瑞人（法政大学教授、翻訳家） 聡明でチャーミングで扱いにくい。 そんなエミリのややこしさが、あの天才的な詩の源である。 あの時代になしえた最大限の抵抗をもって魂の自由を求めたエミリの物語は、 生きにくさを感じるひと全てが観るべきもの。そのかっこよさに心から痺れてほしい。 トミヤマユキコ（ライター、少女マンガ研究者） この情熱は静かすぎて、孤高すぎて、世界の耳まで届かない。 だが、すぐ届いてしまう声では彼女の言葉は聴こえない。 もし耳を傾けるものがいなくても、真摯さの中に詩は残る。 噺家は静かにも孤高にも生きられないが、真摯には生きなきゃなと思った。 笑福亭智丸/疋田龍乃介（落語家、詩人） 小さな世界で痛みを背負うのは、いつも繊細で感じやすい人々だ。 エミリのかたくなさ、崇高さ、聡明さに惹きつけられる。彼女はきっと正しすぎたのだ。 その本質は、真夜中にひっそりと綴られた詩のなかにある。 文月悠光（詩人） おなじ部屋にいたら、まちがいなく小生など瞬殺されたにちがいない辛辣ぶりだが、 その彼女の詩の一説が実はわが家の新しい墓の碑銘である。 Keeps esoteric time（1276番）がそれだ。 Esotericという響きがディキンソンの詩と生涯の核心のように思える。 滝本 誠（評論家） もっともしずかな者が、もっとも激しい。 荒々しい夜に閉じこもる者こそ、広い夏空を知っている。 彼女の戦いがいかに苛烈なものだったかを初めて知った。 詩とは勇気であり希望なのだと、エミリが教えてくれた。 管 啓次郎（詩人、明治大学教授） お茶目でちょっと不良で、ひとりぼっちで深淵を覗いていた、わたしたちの大好きなエミリ。 130年の時を超えて、アマストの生家で、 美しい花々の庭で、快活に読まれる詩が彼女を取り戻していくようだ。 暁方ミセイ（詩人） ちょうど映像にあわせてエミリ・ディキンスンの詩を共に読み返しているよう。 描かれているのはひとりの孤高の詩人の姿なのだが、 それを演じる、それを撮る、それを観る、私たちひとりひとりが、 今なお彼女の詩に心動かされていることを痛感せずにいられない。 小林エリカ（作家、マンガ家） 成長しない、ということの気高さと、失う、ということの豊かさの狭間で、 彼女が言葉を求めたのではなく、言葉が彼女を求めたのではなかったか。 言葉たちは彼女によって紡がれ、放たれることを待っていた。 答えを返してくれない神のように。 中川龍太郎（映画監督、詩人） 演じられたディキンスンから、ディキンスンの幽霊が風のように現れまた消えた。 炎の光に潤む瞳。言葉の立ち消えた空間へ、詩の声が静かに広がっていく。 むしろ主役は詩。演者たちの慎ましさ。心の深部を慰められる。 小池昌代（詩人、小説家） たくさん話す映画のエミリ。 そして読者のやわらかな感情の丘に、そっと口づけするエミリ・ディキンスン。 ゆっくりとこちらを振りむくその緑の瞳が、どちらもじっとこちらを覗き込んでいるように思うのは、 わたしたちは老いてずっと幼いままだから。 あなたが消えて１３０年たった今この瞬間も。 岡本 啓（詩人） 描かれる女性の生が、生き方が、詩を生みだすのか、 それとも詩が女性の生き方を、姿を生みだすのか。 ことばと演戯と映像と、それらの「あいだ」に未知な詩人、 エミリ・ディキンソンの深淵が、ふと、かいまみる。 小沼純一（早稲田大学文学学術院 教授） エミリ・ディキンスンは、私の中のめちゃくちゃかっこいい先輩のひとりです。 映画の中、主演のシンシア・ニクソンの声が澄んでいました。 先輩の生き様を心に刻んで、たゆまずくさらず私もやります。 柴田聡子（ミュージシャン、詩人） エミリは、何かが何かを代表して権威となることに疑問を抱いた人。 言葉が素（もと）の心を裏切り、人の真実を隠すことを見つめた人。 だから、その詩は指差していますよ。 かたくなな心の扉をこじ開ける鍵は、もうすでにあなたの掌にあること、 じぶんの力を信じて鍛えなくてはならない、と。 ぱくきょんみ（詩人） 自分に正直に生きることの孤独。 ディキンスンにとって、その孤独を支えたのも、 その孤独を鮮明にしたのも、詩だったのですね。 木坂 涼（詩人・児童文学作家） （順不同・敬称略） 映画『静かなる情熱 エミリ･ディキンスン』公式サイト PAGE TOP,,https://www.facebook.com/dickinsonfilm/,ニュース,https://twitter.com/dickinson_film,Twitter,https://www.facebook.com/dickinsonfilm/,Facebook
